,Definition,ClassificationLevel
3960,"mucinous tubular and spindle cell renal carcinoma is a rare subtype of renal cell carcinoma characterized, histologically, by tubular architecture and sheets of spindle cells embedded in a mucinous/myxoid stroma and, macroscopically, by a solid, generally well-circumscribed, partially encapsulated tumor of variable size, with a homogenously colored, bulging cut surface, occassionally containing areas of hemorrhage or necrosis, usually located in the cortex. patients can present abdominal/flank pain, adbominal mass and/or hematuria, however most are asymptomatic and tumor is discovered incidentally. indolent behavior is frequent and association with nephrolithiasis and end-stage kidney disease has been noted.",Disorder
3962,"multilocular cystic renal neoplasm of low malignant potential is a rare subtype of clear cell renal cell carcinoma with distinct pathological features of cysts lined by occasionally flattened cuboidal clear cells and septa containing aggregates of epithelial cells with clear cytoplasm, and excellent prognosis. the tumor usually presents as an asymptomatic, unilateral, solitary lesion, macroscopically consisting of numerous, fluid-filled, septated cysts of variable size. rarely, the symptoms typically associated with renal tumors (flank pain, hematuria, palpable mass) may be present.",Subtype of disorder
3963,"papillary renal cell carcinoma is a rare subtype of renal cell carcinoma, arising from the renal tubular epithelium and showing a papillary growth pattern, which typically manifests with hematuria, flank pain, palpable abdominal mass or nonspecific symptoms, such as fatigue, weight loss or fever. symptoms related to metastatic spread, such as bone pain or persistent cough, are frequently associated since early diagnosis is not common. it is typically multifocal, bilateral, and in most cases sporadic, although different hereditary syndromes, such as hereditary leiomyoma renal cell carcinoma, birt-hogg-dubé syndrome and tuberous sclerosis, may predispose to the development of papillary renal cell carcinoma.",Disorder
3964,"chromophobe renal cell carcinoma is a rare subtype of renal cell carcinoma, originating from the intercalating cells of the collecting ducts and macroscopically manifesting as a well-circumscribed, highly lobulated, solid tumor that is usually diagnosed at an early stage. it is frequently asymptomatic, or may present with nonspecific symptoms, such as weight loss, fever or fatigue. the classic presentation observed in renal tumors (hematuria, flank pain and palpable mass) is occasionally observed and usually indicates an advanced stage of the disease. it is most frequently sporadic however, several familial cases, associated with birt-hogg dubé syndrome, have been described.",Disorder
3965,"mit family translocation renal cell carcinoma (t-rcc) is a rare subtype of renal cell carcinoma with recurrent genetic abnormalities, harboring rearrangements of the <i>tfe3</i> (xp11 t-rcc) or <i>tfeb</i> [t(6;11) t-rcc] genes. the t(6;11) t-rcc has distinctive histologic features of biphasic appearance with larger epitheloid and smaller eosinophilic cells. the symptoms are usually non-specific and include hematuria, flank pain, palpable abdominal mass and/or systemic symptoms of anemia, fatigue and fever.",Disorder
4012,"primary bone lymphoma is a rare lymphoid hemopathy defined as single or multiple tumors in the bone, not associated with infringement or violation of other extranodal malignant lymph nodes outside the area. it usually presents with bone pain, nerve compression, a palpable mass or fracture, while systemic features (fever, night sweats, fatigue, loss of appetite, weight loss) are not common.",Disorder
4036,"primary dystonia, dyt17 type is a rare, genetic, isolated dystonia initially presenting as torticollis, and later progressing to segmental or generalized dystonia. dysphonia and dysarthria also occur later in the disease course.",Disorder
4039,"small cell carcinoma of the ovary is a rare, highly aggressive, poorly differentiated ovarian neoplasm, often associated with paraneoplastic hypercalcemia. it is usually diagnosed in childhood or young adulthood at an advanced stage and presents with abdominal or pelvic mass or, rarely, symptoms related to hypercalcemia. occasional familial cases have been reported.",Disorder
4041,"extraskeletal ewing sarcoma is a rare, poorly differentiated, highly malignant, soft tissue tumor, derived from neuroectoderm, that is morphologically indistinguishable from skeletal ewing sarcoma but is located in extraosseous locations, with the most common being: chest wall, paravertebral region, abdominopelvic area (with predilection for the retroperitoneal space), gluteal region and lower extremities. clinical presentation is highly variable and depends on tumor localization. local recurrence is common and metastatic disease most frequently involves the bones and lungs.",Disorder
4105,"non-immune hydrops fetalis (nihf), a form of hf, is a severe fetal condition defined as the excessive accumulation of fetal fluid within the fetal extravascular compartments and body cavities, and is the end-stage of a wide variety of disorders.",Subtype of disorder
4107,"immune hydrops fetalis (ihf), a form of hf, describes the excessive accumulation of fetal fluid within the fetal extravascular compartments and body cavities due to maternal rhesus (rh) incompatibility.",Subtype of disorder
4154,"a form of testicular germ cell tumor occurring in the third decade of life with a usually painless unilateral mass in the scrotum or, in some cases, with gynaecomastia and/or back and flack pain. the clinical course is more aggressive than testicular seminomatous germ cell tumors with rapid involvement of blood vessels and a poorer prognosis. histologically, the tumour can be either undifferentiated (embryonal carcinoma), differentiated (teratoma, yolk sac tumor, choriocarcinoma), or can consist of a mixture of seminomatous and nonseminomatous components.",Disorder
4162,"a group of rare tumors of testis comprising neoplasms of pure sex cord or pure stromal type, or neoplasms with admixtures of both components in various proportions and degree of differentiation. the tumors usually present as a painless testicular mass, although some may be associated with endocrine manifestations such as precocious puberty, gynecomastia, or erectile dysfunction. malignant behavior is seen only in a small percentage of these tumors.",Disorder
4185,venous thoracic outlet syndrome (vtos) is a form of thoracic outlet syndrome (tos; see this term) that manifests as unilateral (rarely bilateral) arm pain and cyanosis.,Subtype of disorder
4186,a form of thoracic outlet syndrome that presents as unilateral upper extremity ischemia.,Subtype of disorder
4194,"a partial autosomal monosomy characterized clinically by lethal pulmonary disease that presents as severe respiratory distress and refractory pulmonary hypertension within a few hours after birth and typically results in death from respiratory failure within the first months of life. characteristic histological features of lung tissue include paucity of alveolar wall capillaries, alveolar wall thickening, muscular hypertrophy of the pulmonary arteries, and malposition of the small pulmonary veins. various additional congenital malformations may be associated, mostly gastrointestinal (intestinal malrotation and atresias, anular pancreas), genitourinary (dilatation of urinary tracts, duplicated uterus) and cardiovascular anomalies (hypoplastic left heart and other congenital heart defects).",Disorder
4195,"a partial autosomal monosomy characterized clinically by lethal pulmonary disease that presents as severe respiratory distress and refractory pulmonary hypertension within a few hours after birth and typically results in death from respiratory failure within the first months of life. characteristic histological features of lung tissue include paucity of alveolar wall capillaries, alveolar wall thickening, muscular hypertrophy of the pulmonary arteries, and malposition of the small pulmonary veins. various additional congenital malformations may be associated, mostly gastrointestinal (intestinal malrotation and atresias, anular pancreas), genitourinary (dilatation of urinary tracts, duplicated uterus) and cardiovascular anomalies (hypoplastic left heart and other congenital heart defects).",Disorder
4228,"a rare, genetic immuno-osseous dysplasia associated with pre- and post-natal growth retardation, retinopathy, microcephaly, intellectual disability and dysmorphic features.",Disorder
4229,"a rare, genetic immuno-osseous dysplasia associated with pre- and post-natal growth retardation, retinopathy, microcephaly, intellectual disability and dysmorphic features.",Subtype of disorder
4230,"a rare, genetic immuno-osseous dysplasia associated with pre- and post-natal growth retardation, retinopathy, microcephaly, intellectual disability and dysmorphic features.",Subtype of disorder
4262,"a rare, autosomal dominant, eye disorder representing a constellation of inherited ocular findings, including early-onset or congenital cataracts, corneal stromal thinning, early-onset keratoconus, corneal endothelial dystrophy, and iris hypoplasia.",Disorder
4271,"mitf-related melanoma and renal cell carcinoma predisposition syndrome is an inherited cancer-predisposing syndrome due to a gain-of-function germline mutation in the mitf gene, associated with a higher incidence of amelanotic and nodular melanoma, multiple primary melanomas and increase in nevus number and size. it may also predispose to co-occurring melanoma and renal cell carcinoma and to pancreatic cancer.",Disorder
4274,"ketamine-induced biliary dilatation is an acquired biliary tract disease caused by the abusive consumption of ketamine, which results in the fusiform dilatation of the common bile ducts (cbd) without obstructive lesions or dilatation of the intrahepatic biliary ducts. possible manifestations of the underlying cholangiopathy include epigastric pain and impaired liver function. severity of cbd dilatation appears to correlate with the duration of ketamine consumption and the condition has been reported to be reversible in abstinent patients.",Disorder
4342,a rare form of glycine encephalopathy presenting disease onset or clinical manifestations that differ from neonatal or infantile glycine encephalopathy.,Subtype of disorder
4344,"lymphoepithelial-like carcinoma is a rare, malignant epithelial tumor, composed of undifferentiated epithelial cells with dense lymphoid stroma, mimicking lymphoepithelioma. it often shows association with epstein-barr virus infection and can develop in various organs, such as the nasopharynx, stomach, skin, breast and lungs, among others. the presenting symptoms, as well as the radiologic features, are usually nonspecific and depend on the affected site and organ.",Disorder
4353,"multiple mitochondrial dysfunctions syndrome describes a group of rare inborn errors of energy metabolism due to defects in mitochondrial [4fe-4s] protein assembly. patients present with a neonatal/infancy onset of metabolic lactic acidosis (that may be associated with hyperglycinemia and other abnormal metabolic testing results), muscular hypotonia, absence of psychomotor development or developmental regression, as well as abnormal neuroimaging findings (including leukodystrophy, brain developmental defects, white matter abnormalities, cerebral atrophy), and other variable clinical features (e.g., optic atrophy, cardiomyopathy, pulmonary hypertension, seizures, and dysmorphic features). early fatal outcome is usual.",Group of disorders
4357,"bap1-related tumor predisposition syndrome (tpds) is an inherited cancer-predisposing syndrome, associated with germline mutations in bap1 tumor suppressor gene. the most commonly observed cancer types include uveal melanoma, malignant mesothelioma, renal cell carcinoma, lung, ovarian, pancreatic, breast cancer and meningioma, with variable age of onset. common cutaneous manifestations include malignant melanoma, basal cell carcinoma and benign melanocytic bap1-mutated atypical intradermal tumors (mbait) presenting as multiple skin-coloured to reddish-brown dome-shaped to pedunculated, well-circumscribed papules with an average size of 5 mm, histologically predominantly composed of epithelioid melanocytes with abundant amphophilic cytoplasm, prominent nucleoli and large, vesicular nuclei that vary substantially in size and shape.",Disorder
4359,"juvenile nasopharyngeal angiofibroma (jna) is a rare and benign but locally aggressive fibrovascular tumor arising from the posterolateral wall of the nasopharynx, which affects mainly young and adolescent males (onset usually occurring between 7-19 years of age) and that presents as a mass in the nasopharynx and nasal cavity, leading to manifestations such as nasal obstruction, epistaxis, profound facial swelling, proptosis or diplopia. although slowly progressive, it has a high rate of recurrence and sometimes invades adjacent structures.",Disorder
4378,a rare genetic disease that belongs to the group of extreme insulin-resistance syndromes and is due to autoantibodies directed against insulin receptor.,Disorder
4379,a rare genetic disease that belongs to the group of extreme insulin-resistance syndromes and is due to autoantibodies directed against insulin receptor.,Group of disorders
4386,"a rare disease caused by compression of the celiac axis by an abnormally shaped arcuate ligament (the part of the diaphragm in which both pillars join in the midline around the aorta). patients have recurrent abdominal pain, anorexia and weight loss. the pain is epigastric, and diarrhea or constipation may be present as well. onset of pain will usually, although not always, be after food intake, and may be associated with nausea and emesis. other symptoms may include lassitude, exercise intolerance and vomiting. occasionally, a patient may show an abdominal murmur upon auscultation.",Disorder
4387,"a form of filariasis, distributed throughout sub-saharan africa as well as in some locations of central and south america and the caribbean, caused by the parasitic worms <i>mansonella perstans</i> and <i>mansonella ozzardi</i>. the disease is often asymptomatic but may also cause fever, vertigo, myalgias, arthralgias and a sensation of coldness in the legs. additional features include neuropsychiatric symptoms, skin rash, pruritus, nodules containing adult worms (in the conjunctiva or eyelids), lymphadenopathy, recurrent lymphedema in the limbs and face (resembling the calabar swellings of loasis), severe abdominal pain and endocrine disturbances.",Disorder
4388,"loiasis is a form of filariasis (see this term), caused by the parasitic worm <i>loa loa</i>, endemic to the forest and savannah regions of central and western africa. loiasis may either be asymptomatic or manifest as a large, transient area of localized, non-erythematous subcutaneous edema (calabar swellings), adult worm migration through the sub-conjunctiva (''african eye worm'') and pruritus. generalized itching, hives, muscle pains, arthralgias, fatigue, and adult worms visibly migrating under the surface of the skin may be observed. severe complications such as encephalopathy have been reported in highly infected individuals receiving ivermectin during mass drug administration programs for the control of onchocerciasis and lymphatic filariasis (see these terms).",Disorder
4390,"a disorder with extraparenchymal cysts, intra-arachnoidal collections of fluid, the composition of which is close to that of cerebrospinal fluid. they are often asymptomatic.",Disorder
4391,"a rare inflammatory multisystem disorder characterized clinically by four cardinal signs: fever of unknown origin, arthralgia or arthritis, hyperleucocytosis, and typical skin rash.",Disorder
4398,"non-rhizomelic chondrodysplasia punctata is a form of chondrodysplasia punctata (see this term), a group of diseases in which the common characteristic is bone calcifications near joints from birth. non-rhizomelic chondrodysplasia punctata is not an entity in itself but covers several diseases with variable clinical findings and modes of transmission.",Group of disorders
4400,"lymphatic filariasis (lf) is a severe form of filariasis (see this term), caused by the parasitic worms <i>wuchereria bancrofti</i>, <i>brugia malayi</i> and <i>brugia timori</i>, and the most common cause of acquired lymphedema worldwide. lf is endemic to tropical and subtropical regions. the vast majority of infected patients are asymptomatic but it can also cause a variety of clinical manifestations, including limb lymphedema, genital anomalies (hydrocele, chylocele), elephantiasis in later stages of the disease (frequently in the lower extremities), and tropical pulmonary eosinophilia (nocturnal paroxysmal cough and wheezing, weight loss, low-grade fever, adenopathy, and pronounced blood eosinophilia). renal involvement (hematuria, proteinuria, nephritic syndrome, glomerulonephritis), and mono-arthritis of the knee or ankle joint have also been reported.",Disorder
4401,"lymphatic filariasis (lf) is a severe form of filariasis (see this term), caused by the parasitic worms <i>wuchereria bancrofti</i>, <i>brugia malayi</i> and <i>brugia timori</i>, and the most common cause of acquired lymphedema worldwide. lf is endemic to tropical and subtropical regions. the vast majority of infected patients are asymptomatic but it can also cause a variety of clinical manifestations, including limb lymphedema, genital anomalies (hydrocele, chylocele), elephantiasis in later stages of the disease (frequently in the lower extremities), and tropical pulmonary eosinophilia (nocturnal paroxysmal cough and wheezing, weight loss, low-grade fever, adenopathy, and pronounced blood eosinophilia). renal involvement (hematuria, proteinuria, nephritic syndrome, glomerulonephritis), and mono-arthritis of the knee or ankle joint have also been reported.",Disorder
4402,"lymphatic filariasis (lf) is a severe form of filariasis (see this term), caused by the parasitic worms <i>wuchereria bancrofti</i>, <i>brugia malayi</i> and <i>brugia timori</i>, and the most common cause of acquired lymphedema worldwide. lf is endemic to tropical and subtropical regions. the vast majority of infected patients are asymptomatic but it can also cause a variety of clinical manifestations, including limb lymphedema, genital anomalies (hydrocele, chylocele), elephantiasis in later stages of the disease (frequently in the lower extremities), and tropical pulmonary eosinophilia (nocturnal paroxysmal cough and wheezing, weight loss, low-grade fever, adenopathy, and pronounced blood eosinophilia). renal involvement (hematuria, proteinuria, nephritic syndrome, glomerulonephritis), and mono-arthritis of the knee or ankle joint have also been reported.",Group of disorders
4407,"phosphoserine aminotransferase deficiency is an extremely rare form of serine deficiency syndrome (see this term) characterized clinically in the two reported cases to date by acquired microcephaly, psychomotor retardation, intractable seizures and hypertonia.",Subtype of disorder
4422,"tropical spastic paraparesis is a chronic systemic immune-mediated inflammatory myeloneuropathy, more frequently reported in women than in men, that usually presents in adulthood with slowly progressive spastic paraparesis of the lower limbs, bladder and bowel dysfunction, and sensory disturbances in the lower extremities (e.g. paresthesia and dysesthesia) and that is associated with a human t-cell lymphotropic virus type 1 (htlv-1) infection.",Disorder
4443,syndromic recessive x-linked ichthyosis (rxli) refers to the cases of rxli (see this term) that are associated with extracutaneous manifestations as part of a syndrome.,Disorder
4444,syndromic recessive x-linked ichthyosis (rxli) refers to the cases of rxli (see this term) that are associated with extracutaneous manifestations as part of a syndrome.,Group of disorders
4445,syndromic recessive x-linked ichthyosis (rxli) refers to the cases of rxli (see this term) that are associated with extracutaneous manifestations as part of a syndrome.,Disorder
4478,"8q21.11 microdeletion syndrome encompasses heterozygous overlapping microdeletions on chromosome 8q21.11 resulting in intellectual disability, facial dysmorphism comprising a round face, ptosis, short philtrum, cupid's bow and prominent low-set ears, nasal speech and mild finger and toe anomalies.",Disorder
4489,"pontocerebellar hypoplasia type 7 (pch7) is a novel very rare form of pontocerebellar hypoplasia (see this term) with unknown etiology and poor prognosis reported in four patients and is characterized clinically during the neonatal period by hypotonia, no palpable gonads, micropenis and from infancy by progressive microcephaly, apneic episodes, poor feeding, seizures and regression of penis. mri demonstrates a pontocerebellar hypoplasia. pch7 is expressed as pch with 46,xy disorder of sex development (see this term) in individuals with xy karyotype, and may be expressed as pch only in individuals with xx karyotype.",Disorder
4495,"small cell carcinoma of the bladder (sccb) is a very rare, poorly differentiated neuroendocrine epithelial bladder tumor characterized clinically by hematuria and/or dysuria and a highly aggressive course.",Disorder
4554,"a rare parkinsonian syndrome due to intoxication which develops in individuals surviving an acute cyanide intoxication episode or due to chronic exposure to small cyanide doses. it presents several weeks after acute exposure with progressive typical clinical features of parkinsonism including bradykinesia, rigidity, dystonia, hypomimia, hypokinetic dysarthria, postural instability and retropulsion but no resting or postural tremor. brain mri reveals bilateral lesions in the pallidum, posterior putamen, substantia nigra, subthalamic nucleus, temporal and occipital cortex, and cerebellum.",Disorder
4557,"primary dystonia, dyt21 type is a subtype of mixed dystonia with a late-onset form of pure torsion dystonia.",Disorder
4584,chordomas are rare malignant tumors arising from embryonic remnants of the notochord in axial skeleton.,Disorder
4585,chordomas are rare malignant tumors arising from embryonic remnants of the notochord in axial skeleton.,Subtype of disorder
4623,"carcinoma of the ampulla of vater is a rare malignant tumor originating from the ampulla of vater that can present with symptoms of general fatigue, loss of appetite, weight loss, nausea, vomiting, abdominal pain and, most commonly, painless obstructive jaundice. the tumor is believed to arise from duodenal, biliary or pancreatic epilthelium, resulting in the respective histological types. in general, carcinoma of the ampulla of vater has a better prognosis (5-year survival rate of 45%) than cancers of the distal bile duct and pancreas.",Disorder
4636,primary cutaneous anaplastic large cell lymphoma (c-alcl) is a rare t-cell non-hodgkin lymphoma that affects the skin and generally shows no extracutaneous involvement at presentation. it belongs to the spectrum of primary cutaneous cd30+ lymphoproliferative disorders along with lymphomatoid papulosis (see this term) with which it shares overlapping clinical and histopathologic features.,Disorder
4637,"t-cell/histiocyte rich large b cell lymphoma (thrlbcl) is a rare variant of diffuse large b-cell lymphoma (dlbcl; see this term), mainly affecting middle-aged men and often not being discovered until an advanced disease stage, with involvement of the spleen, liver and bone marrow occurring at a greater frequency than in dlbcl. it is often difficult to diagnose due to its similarity with other lymphoid diseases such as classic hodgkin lymphoma and nodular lymphocyte-predominant hodgkin lymphoma (see these terms) and has an aggressive clinical course.",Disorder
4641,"diffuse large b-cell lymphoma with chronic inflammation is an epstein-barr virus-associated malignant lymphoproliferative disorder, developing in a context of long-standing or slow-growing, chronically inflamed lesions, such as chronic pyothorax, metallic implants in bones and joints, chronic osteomyelitis, chronic venous ulcer, or, rarely granulomatous inflammation. the tumor is usually primarily localized, with no involvement of other organs.",Disorder
4650,"fadd-related immunodeficiency is a rare genetic immunological disease reported in a single consanguineous pakistani family with several affected members presenting with severe bacterial and viral infections, recurrent hepatopathy (portal inflammation, fibrosis), and recurrent, stereotypical febrile episodes, sometimes lasting several days, with encephalopathy and difficult-to-control seizures. variable cardiac malformations were also reported. although there were autoimmune lymphoproliferative syndrome (alps)-like biological features, clinical alps was not present. a homozygous missense mutation in the <i>fadd</i> gene (11q13.3) was found in the family and the disease is thought to follow an autosomal recessive pattern of inheritance.",Disorder
4657,"isolated hereditary congenital facial paralysis (ihcfp) is an extremely rare neurological disorder presumed to result from maldevelopment of the facial nucleus and/or cranial nerve and has been reported in fewer than 10 families to date. it manifests as non-progressive, isolated, unilateral or bilateral, symmetrical or asymmetrical facial palsy. involvement of the branches of the facial nerve can be unequal.",Disorder
