,Definition,ClassificationLevel
6357,"a rare systemic disease for which two subtypes exist, either related to the gene <i>plod1</i> or <i>fkbp22</i>, and for which the clinically overlapping characteristics include congenital muscle hypotonia, congenital or early-onset kyphoscoliosis (progressive or non-progressive), and generalized joint hypermobility with dislocations/subluxations (in particular of the shoulders, hips, and knees). additional features which may occur in both subtypes are skin hyperextensibility, easy bruising of the skin, rupture/aneurysm of a medium-sized artery, osteopenia/osteoporosis, blue sclerae, umbilical or inguinal hernia, chest deformity, marfanoid habitus, talipes equinovarus, and refractive errors. gene-specific features, with variable presentation, are additionally observed in each subtype.",Disorder
6367,"x-linked creatine transporter deficiency (crtr-d) is a creatine deficiency syndrome characterized clinically by global developmental delay/ intellectual disability (dd/id) with prominent speech/language delay, autistic behavior and seizures.",Disorder
6370,mantle cell lymphoma is a rare form of malignant non-hodgkin lymphoma (see this term) affecting b lymphocytes in the lymph nodes in a region called the ``mantle zone''.,Disorder
6372,"malt (mucosa-associated lymphoid tissue) lymphoma is a rare form of malignant non-hodgkin lymphoma (see this term) that affects b cells and grows at the expense of lymphoid tissue associated with mucous membranes, but also occurs, more rarely, in lymph nodes.",Disorder
6383,congenital lactase deficiency is a rare severe gastrointestinal disorder in newborns primarily reported in finland and characterized clinically by watery diarrhea on feeding with breast-milk or lactose-containing formula.,Disorder
6392,"a rare cardiomyopathy characterized anatomically by prominent left ventricular trabeculae and deep intratrabecular recesses causing progressive systolic and diastolic dysfunction, conduction abnormalities, and occasionally thromboembolic events.",Disorder
6395,corticosteroid-sensitive aseptic abscesses syndrome is a well-defined entity within the group of autoinflammatory disorders.,Disorder
6400,"plummer-vinson or paterson-kelly syndrome presents as a classical triad of dysphagia, iron-deficiency anemia and esophageal webs.",Disorder
6402,"cobb syndrome is defined by the association of vascular cutaneous (venous or arteriovenous), muscular (arteriovenous), osseous (arteriovenous) and medullary (arteriovenous) lesions at the same metamere or spinal segment. this segmental distribution may involve one or many of the 31 metameres present in humans. only 16% of the medullary lesions are multiple and have a clearly metameric distribution.",Disorder
6403,"cobb syndrome is defined by the association of vascular cutaneous (venous or arteriovenous), muscular (arteriovenous), osseous (arteriovenous) and medullary (arteriovenous) lesions at the same metamere or spinal segment. this segmental distribution may involve one or many of the 31 metameres present in humans. only 16% of the medullary lesions are multiple and have a clearly metameric distribution.",Disorder
6419,congenital cataracts facial dysmorphism neuropathy (ccfdn) syndrome is a complex developmental disorder of autosomal recessive inheritance.,Disorder
6434,"malignant mesothelioma is a fatal asbestos-associated malignancy arising in the lining cells (mesothelium) of the pleural and peritoneal cavities, as well as in the pericardium and the tunica vaginalis.",Disorder
6440,"cat-scratch disease is a rare infectious disease, caused by the gram-negative bacteria <i>bartonella henselae</i>, that is transmitted to humans via a scratch or bite of an infected cat and that has a variable clinical presentation but that usually manifests with an erythematous papule at the site of inoculation followed by chronic regional lymphadenopathy. clinical course is usually self-limiting but disseminated illness with high fever, hepatosplenomegaly, granulomatous osteolytic lesions, encephalitis, retinitis, and atypical pneumonia can also occur. cat-scratch disease can atypically present as parinaud oculoglandular syndrome (unilateral conjunctivitis and preauricular lymphadenopathy).",Disorder
6441,"cat-scratch disease is a rare infectious disease, caused by the gram-negative bacteria <i>bartonella henselae</i>, that is transmitted to humans via a scratch or bite of an infected cat and that has a variable clinical presentation but that usually manifests with an erythematous papule at the site of inoculation followed by chronic regional lymphadenopathy. clinical course is usually self-limiting but disseminated illness with high fever, hepatosplenomegaly, granulomatous osteolytic lesions, encephalitis, retinitis, and atypical pneumonia can also occur. cat-scratch disease can atypically present as parinaud oculoglandular syndrome (unilateral conjunctivitis and preauricular lymphadenopathy).",Disorder
6452,"ethylmalonic acid encephalopathy (ee) is defined by elevated excretion of ethylmalonic acid (ema) with recurrent petechiae, orthostatic acrocyanosis and chronic diarrhoea associated with neurodevelopmental delay, psychomotor regression and hypotonia with brain magnetic resonance imaging (mri) abnormalities.",Disorder
6454,"a rare disorder of folate metabolism and transport characterized, biochemically, by elevated formiminoglutamate in urine and plasma due to glutamate formiminotransferase deficiency, associated with a highly variable clinical phenotype, ranging from developmental delay, intellectual disability and anemia to normal development without anemia. increased hydantoin-5-propionic acid and/or folate in plasma may also be associated.",Disorder
6459,a chronic neuropathic pain syndrome of the abdominal wall caused by entrapment of anterior cutaneous branches of 7 to 12th intercostal nerves along the lateral border of the anterior rectus abdominis fascia causing severe pain and tenderness of the involved dermatome.,Disorder
6480,"a group of rare congenital coronary artery malformations comprising abnormal number of coronary ostia, malposition of a coronary ostium, and stenosis or atresia of a coronary ostium. patients may remain asymptomatic or present with variable signs and symptoms, depending on the nature and severity of the malformation, including failure to thrive, dyspnea, syncope, angina pectoris, ventricular tachycardia, and myocardial ischemia.",Group of disorders
6481,"gastrointestinal stromal tumor (gist) is the most common mesenchymal neoplasm of the gastrointestinal (gi) tract, typically presenting in adults over the age of 40 (mean age 63), and only rarely in children, in various regions of the gi tract, most commonly the stomach or small intestine but also less commonly in the esophagus, appendix, rectum and colon. gists can be asymptomatic or present with various non-specific signs, depending on the location and size of tumor, such as loss of appetite, anemia, weight loss, fatigue, abdominal discomfort or fullness, nausea, vomiting, as well as an abdominal mass, blood in stool, and intestinal obstruction. gists can also be seen in familial syndromes such as carney triad and neurofibromatosis type 1.",Disorder
6482,"gastrointestinal stromal tumor (gist) is the most common mesenchymal neoplasm of the gastrointestinal (gi) tract, typically presenting in adults over the age of 40 (mean age 63), and only rarely in children, in various regions of the gi tract, most commonly the stomach or small intestine but also less commonly in the esophagus, appendix, rectum and colon. gists can be asymptomatic or present with various non-specific signs, depending on the location and size of tumor, such as loss of appetite, anemia, weight loss, fatigue, abdominal discomfort or fullness, nausea, vomiting, as well as an abdominal mass, blood in stool, and intestinal obstruction. gists can also be seen in familial syndromes such as carney triad and neurofibromatosis type 1.",Disorder
6490,oligodendrogliomas are cerebral tumors that are differentiated from other gliomas on the basis of their unique genetic characteristics and better response to chemotherapy. these tumors are classified according to their grade (low grade oligodendrogliomas: grade ii of the who classification and anaplastic oligodendrogliomas: grade iii of the who classification) and according to their pure or mixed histology (oligoastrocytomas).,Group of disorders
6495,"cerebral arteriovenous malformation (avm) is a congenital malformative communication between the veins and the arteries in the brain in the form of a nidus, an anatomical structure composed of dilated and tangled supplying arterioles and drainage veins with no intervening capillary bed, that can be asymptomatic or cause, depending on the location and the size of the avm, headaches of varying severity, generalized or focal seizures, focalneurological defects (weakness, numbness, speech difficulties, vision loss) or potentially fatal intracranial hemorrhage in case the avm ruptures.",Disorder
6500,a form of portosinusoidal vascular disease characterized histologically by the absence of cirrhosis and diffuse benign transformation of the hepatic parenchyma into multiple small nodules (typically 1-3 mm).,Subtype of disorder
6547,"a rare retinal vasoproliferative disease affecting preterm infants characterized initially by a delay in physiologic retinal vascular development and compromised physiologic vascularity, and subsequently by aberrant angiogenesis in the form of intravitreal neovascularization.",Disorder
6551,"familial pseudohyperkalemia (fp) is an inherited, mild, non-hemolytic subtype of hereditary stomatocytosis that is associated with a temperature-dependent anomaly in red cell membrane permeability to potassium that leads to high <i>in vitro</i> potassium levels in samples stored below 37°c. fp is not associated with additional hematological abnormalities, although affected individuals may show some mild abnormalities like macrocytosis.",Disorder
6553,"a rare clinical situation for which there is a european and/or american orphan designation. characteristics include diffuse bleeding into the alveolar spaces that originate from the pulmonary microvasculature, including the alveolar capillaries, arterioles and venules. patients present with cough, dyspnea, chest pain, fever, anemia and hemoptysis.",Disorder
6554,"deafness with labyrinthine aplasia, microtia, and microdontia (lamm) is a genetic transmission deafness syndrome.",Disorder
6561,"drug-induced autoimmune hemolytic anemia is a type of autoimmune hemolytic anemia (aiha; see this term) that occurs as a reaction to therapeutic drugs, and can be due to various mechanisms.",Disorder
6564,"mixed autoimmune hemolytic anemia is a type of autoimmune hemolytic anemia (aiha; see this term) defined by the presence of both warm and cold autoantibodies, which have a deleterious effect on red blood cells at either body temperature or at lower temperatures.",Disorder
6566,warm autoimmune hemolytic anemia is the most common form of autoimmune hemolytic anemia (see this term) defined by the presence of warm autoantibodies against red blood cells (autoantibodies that are active at temperatures between 37-40°c).,Disorder
6578,"erythema elevatum diutinum (eed) is a distinctive form of chronic cutaneous vasculitis, belonging to the group of the neutrophilic dermatoses.",Disorder
6579,"erythema elevatum diutinum (eed) is a distinctive form of chronic cutaneous vasculitis, belonging to the group of the neutrophilic dermatoses.",Disorder
6629,"hepatocellular carcinoma is a primary hepatic cancer derived from well-differentiated hepatocytes. it is more frequent in adults than in childhood. symptoms are hepatic mass, abdominal pain and, in advanced stages, jaundice, cachexia and liver failure.",Group of disorders
6633,"a rare genetic odontal or periodontal disorder that represents a group of developmental conditions affecting the structure and clinical appearance of the enamel of all or nearly all the teeth in a more or less equal manner, and which may be associated with morphologic or biochemical changes elsewhere in the body.",Disorder
6634,"a rare genetic odontal or periodontal disorder that represents a group of developmental conditions affecting the structure and clinical appearance of the enamel of all or nearly all the teeth in a more or less equal manner, and which may be associated with morphologic or biochemical changes elsewhere in the body.",Subtype of disorder
6647,"a rare, multisystemic inherited metabolic diseases characterized clinically, by a variable spectrum of severity, primarily comprised of psychomotor delay, myopathy and liver dysfunction. most patients present in infancy, but the onset can be already <i>in utero</i> or in adult age. hypermethioninemia is frequent, but often absent in infancy. creatine kinase is elevated in most patients.",Disorder
6648,"a rare, multisystemic inherited metabolic diseases characterized clinically, by a variable spectrum of severity, primarily comprised of psychomotor delay, myopathy and liver dysfunction. most patients present in infancy, but the onset can be already <i>in utero</i> or in adult age. hypermethioninemia is frequent, but often absent in infancy. creatine kinase is elevated in most patients.",Subtype of disorder
6649,"deafness is the most frequent form of sensorial deficit. in the vast majority of cases, the deafness is termed nonsyndromic or isolated and the hearing loss is the only clinical anomaly reported. in developed counties, 60-80% of cases of early-onset hearing loss are of genetic origin.",Disorder
6713,"crouzon syndrome with acanthosis nigricans (can) is a very rare, clinically heterogeneous form of faciocraniostenosis with crouzon-like features and premature synostosis of cranial sutures (crouzon disease, see this term), associated with acanthosis nigricans (an; see this term).",Disorder
6714,"crouzon syndrome with acanthosis nigricans (can) is a very rare, clinically heterogeneous form of faciocraniostenosis with crouzon-like features and premature synostosis of cranial sutures (crouzon disease, see this term), associated with acanthosis nigricans (an; see this term).",Subtype of disorder
6715,"crouzon syndrome with acanthosis nigricans (can) is a very rare, clinically heterogeneous form of faciocraniostenosis with crouzon-like features and premature synostosis of cranial sutures (crouzon disease, see this term), associated with acanthosis nigricans (an; see this term).",Subtype of disorder
6716,"crouzon syndrome with acanthosis nigricans (can) is a very rare, clinically heterogeneous form of faciocraniostenosis with crouzon-like features and premature synostosis of cranial sutures (crouzon disease, see this term), associated with acanthosis nigricans (an; see this term).",Subtype of disorder
6730,"a rare renal malformation in which the kidney(s) are present but their development is abnormal, leading to malformation of histologic architecture of the kidney and presence of embryological tissue such as mesenchymal collarettes or other forms of undifferentiated and metaplastic tissues. renal dysplasia can be unilateral or bilateral, segmental, and of variable severity.",Disorder
6736,"relapsing fever is an infection caused by bacteria of the genus <i>borrelia</i>, excluding those responsible for lyme disease (see this term) belonging to the <i>borrelia burgdorferi</i> complex.",Disorder
6739,congenital tufting enteropathy is a rare congenital enteropathy presenting with early-onset severe and intractable diarrhea that leads to irreversible intestinal failure.,Disorder
6767,"polydactyly of an index finger or ppd3 is a form of preaxial polydactyly of fingers (see this term), a limb malformation syndrome, where the thumb is replaced by one or two triphalangeal digits with dermatoglyphic pattern specific of the index finger. two forms of ppd3 have been characterized: unilateral and bilateral (see these terms). there have been no further descriptions in the literature since 1962.",Disorder
6792,"spondylometaphyseal dysplasia, 'corner fracture' type is a skeletal dysplasia associated with short stature, developmental coxa vara, progressive hip deformity, simulated 'corner fractures' of long tubular bones and vertebral body abnormalities (mostly oval vertebral bodies).",Disorder
6798,"a type of primary congenital hypothyroidism, a permanent thyroid hormone deficiency that is present from birth due to thyroid resistance to tsh.",Disorder
6839,"isolated cryptophtalmia is a congenital abnormality in which the eyelids are absent and skin covers the ocular bulb, which is often microphthalmic. six cases of complete bilateral crytophthalmia have been described. transmission is autosomal dominant.",Disorder
6852,"chronic pneumonitis of infancy is a rare pediatric form of interstitial lung disease (ild, see this term).",Disorder
6857,lyme disease (named after the towns in the usa where the disease was first identified) is a bacterial infection caused by <i>borrelia burgdorferi</i>.,Disorder
6863,"pilomatrixoma is a rare and benign hair cell-derived tumor occurring mostly in young adults (usually under the age of 20) and characterized as a 3-30 mm solitary, painless, firm, mobile, deep dermal or subcutaneous tumor, most commonly found in the head, neck or upper extremities. when superficial, the tumors tint the skin blue-red. multiple pilomatrixomas are seen in myotonic dystrophy, gardner syndrome, rubinstein-taybi syndrome, and turner syndrome (see these terms).",Disorder
6891,simple (monoclonal) cryoglobulinemia or type i cryoglobulinemia refers to the presence in the serum of one isotype or subclass of immunoglobulin (ig) that precipitates reversibly below 37°c.,Disorder
6915,"milroy disease is a frequent form of primary lymphedema (see this term) characterized generally by painless, chronic lower-limb lymphedema found at birth or developing in the early neonatal period.",Disorder
6916,"milroy disease is a frequent form of primary lymphedema (see this term) characterized generally by painless, chronic lower-limb lymphedema found at birth or developing in the early neonatal period.",Disorder
6917,"milroy disease is a frequent form of primary lymphedema (see this term) characterized generally by painless, chronic lower-limb lymphedema found at birth or developing in the early neonatal period.",Subtype of disorder
6939,"a rare superficial pemphigus disease characterized clinically by well-demarcated, localized, erythematous, scaly, hyperkeratotic, crusted plaques, with frequent butterfly distribution over the malar area of the face (but also commonly involving trunk and scalp, and less frequently the extremities, with a photoexposed distribution). histologically, granular deposits along the dermal-epidermal junction, in addition to intercellular deposition in the upper epidermis, are observed.",Disorder
6942,"pili gemini defines a situation where the papilla's tip of a hair follicle splits during the anagen phase and consequently grows two hair shafts emerging through a single pilary canal. a papilla tip that divides in several tips will produce several hair shafts, a situation named pili multigemini. pili gemini or multigemini can occur in each type of hair.",Disorder
6943,"a rare genetic disease characterized as an inherited skin tumour predisposition syndrome presenting with skin appendage tumours, namely cylindromas, spiradenomas and trichoepitheliomas",Disorder
6944,"a rare genetic disease characterized as an inherited skin tumour predisposition syndrome presenting with skin appendage tumours, namely cylindromas, spiradenomas and trichoepitheliomas",Disorder
6949,"an heterogeneous group of cases that are clinically diagnosed as werner syndrome (ws) but do not carry <i>wrn</i> gene mutations. similar to classical ws caused by <i>wrn</i> mutations, patients generally exhibit an aged appearance and common age-related disorders at earlier ages compared to the general population.",Disorder
6959,gm1 gangliosidosis type 1 is the severe infantile form of gm1 gangliosidosis (see this term) with variable neurological and systemic manifestations.,Subtype of disorder
6960,"a severe form of phenylketonuria (pku) due to phenylalanine hydroxylase deficiency, an inborn error of amino acid metabolism, characterized in untreated patients by severe intellectual deficit and neuropsychiatric complications.",Subtype of disorder
6961,"a severe form of phenylketonuria (pku) due to phenylalanine hydroxylase deficiency, an inborn error of amino acid metabolism, characterized in untreated patients by severe intellectual deficit and neuropsychiatric complications.",Subtype of disorder
6962,"a severe form of phenylketonuria (pku) due to phenylalanine hydroxylase deficiency, an inborn error of amino acid metabolism, characterized in untreated patients by severe intellectual deficit and neuropsychiatric complications.",Subtype of disorder
6963,"glycogenosis due to glucose-6-phosphatase deficiency (g6p) type b, or glycogen storage disease (gsd) type 1b, is a type of glycogenosis due to g6p deficiency (see this term).",Subtype of disorder
6964,"glycogenosis due to glucose-6-phosphatase deficiency (g6p) type a, or glycogen storage disease (gsd) type 1a, is a type of glycogenosis due to g6p deficiency (see this term).",Subtype of disorder
6967,a benign inborn error of glycogen metabolism. it is the mildest form of gsd due to phk deficiency.,Disorder
6970,"a life-threatening metabolic disease with onset in the neonatal period. infants usually develop feeding difficulties, lethargy, and severe liver disease.",Disorder
6978,"familial lcat (lecithin-cholesterol acyltransferase) deficiency (fld) is a form of lecithin-cholesterol acyltransferase deficiency (lcat; see this term) characterized clinically by corneal opacities, hemolytic anemia, and renal failure, and biochemically by severely decreased hdl cholesterol and complete deficiency of the lcat enzyme.",Subtype of disorder
6979,"fish eye disease (fed) is a form of genetic lcat (lecithin-cholesterol acyltransferase) deficiency (see this term) characterized clinically by corneal opacifications, and biochemically by significantly reduced hdl cholesterol and partial lcat enzyme deficiency.",Subtype of disorder
6982,a very rare mild adult type of naga deficiency with the features of angiokeratoma corporis diffusum and mild sensory neuropathy.,Subtype of disorder
6983,"a rare clinically heterogeneous type of naga deficiency with developmental, neurologic and psychiatric manifestations presenting at an intermediate age.",Subtype of disorder
7011,"d-2-hydroxyglutaric aciduria (d-2-hga) is a rare clinically variable neurological form of 2-hydroxyglutaric aciduria (see this term) characterized biochemically by elevated d-2-hydroxyglutaric acid (d-2-hg) in the urine, plasma and cerebrospinal fluid.",Disorder
7015,"pfic1, a type of progressive familial intrahepathic cholestasis (pfic, see this term), is an infantile hereditary disorder in bile formation that is hepatocellular in origin and associated with extrahepatic features.",Subtype of disorder
7016,"progressive familial intrahepatic cholestasis type 2 (pfic2), a type of progressive familial intrahepatic cholestasis (pfic, see this term), is a severe, neonatal, hereditary disorder in bile formation that is hepatocellular in origin and not associated with extrahepatic features. initially, pfic2 was reported under the name byler syndrome.",Subtype of disorder
7017,"progressive familial intrahepatic cholestasis type 3 (pfic3), a type of progressive familial intrahepatic cholestasis (pfic, see this term), is a late-onset hereditary disorder in bile formation that is hepatocellular in origin. onset may occur from infancy to young adulthood.",Subtype of disorder
7020,"3-phosphoglycerate dehydrogenase deficiency (3-pgdh deficiency) is an autosomal recessive form of serine deficiency syndrome (see this term) characterized clinically in the few reported cases by congenital microcephaly, psychomotor retardation and intractable seizures in the infantile form and by absence seizures, moderate developmental delay and behavioral disorders in the juvenile form",Subtype of disorder
7021,"3-phosphoserine phosphatase deficiency is an extremely rare form of serine deficiency syndrome (see this term) characterized clinically by congenital microcephaly and severe psychomotor retardation in the single reported case to date, which was associated with williams syndrome (see this term).",Subtype of disorder
7022,"a rare, non-rhizomelic, chondrodysplasia punctata syndrome characterized, radiologically, by stippled calcifications and disproportionate, short metacarpals and tibiae (with characteristic overshoot of the proximal fibula), clinically manifesting with severe short stature, bilateral shortening of upper and lower limbs, flat midface and nose, in the absence of cataracts and cutaneous anomalies. neonatal tachypnea, hydrocephalus and mild developmental delay have been seldomly associated. additional radiologic features include bowed long bones, platyspondyly and/or vertebral clefts.",Disorder
7028,"idiopathic juvenile osteoporosis (ijo) is a primary condition of bone demineralization that presents with pain in the back and extremities, walking difficulties, multiple fractures, and radiological evidence of osteoporosis.",Disorder
7041,fetal gaucher disease is the perinatal lethal form of gaucher disease (gd; see this term).,Subtype of disorder
