,Definition,ClassificationLevel
2146,"idiopathic recurrent pericarditis is a rare autoinflammatory syndrome defined as recurrence of pericardial inflammation of unknown origin following the first episode of acute pericarditis and a symptom-free interval of 4-6 weeks or longer. recurrent attacks of chest pain may be the sole presentation or the chest pain may be accompanied by pericardial friction rub, electrocardiographic or echocardiographic changes, pericardial effusion and increased c-reactive protein. cardiac tamponade is a rare, life-threatening complication.",Disorder
2147,"idiopathic recurrent pericarditis is a rare autoinflammatory syndrome defined as recurrence of pericardial inflammation of unknown origin following the first episode of acute pericarditis and a symptom-free interval of 4-6 weeks or longer. recurrent attacks of chest pain may be the sole presentation or the chest pain may be accompanied by pericardial friction rub, electrocardiographic or echocardiographic changes, pericardial effusion and increased c-reactive protein. cardiac tamponade is a rare, life-threatening complication.",Subtype of disorder
2160,maternally-inherited mitochondrial dystonia is a rare neurological mitochondrial dna-related disorder characterized clinically by progressive pediatric-onset dystonia with variable degrees of severity.,Disorder
2178,"isolated atp synthase deficiency is a rare, genetic, mitochondrial oxidative phosphorylation disorder that may present with a wide range of symptoms (including muscular hypotonia, hypertrophic cardiomyopathy, psychomotor delay, encephalopathy, peripheral neuropathy, lactic acidosis, 3-methylglutaconic aciduria) and clinical syndromes (including narp and mils).",Disorder
2182,a very rare non-syndromic autosomal recessive pyridoxine-refractory sideroblastic anemia due to a splice defect of glutaredoxin-5 (<i>glrx5</i>) described in a single patient with adult onset microcytic hypochromic anemia with liver iron overload and type 2 diabetes.,Disorder
2185,median nodule of the upper lip is a minor trait of the lip transmitted in an autosomal dominant fashion.,Disorder
2191,renal tubulopathy - encephalopathy - liver failure describes a spectrum of phenotypes with manifestations similar but milder than those seen in gracile syndrome (see this term) and that can be associated with encephalopathy and psychiatric disorders.,Disorder
2206,"maternally inherited leigh syndrome is a rare subtype of leigh syndrome (see this term) characterized clinically by encephalopathy, lactic acidosis, seizures, cardiomyopathy, respiratory disorders and developmental delay, with onset in infancy or early childhood, and resulting from maternally-inherited mutations in mitochondrial dna.",Disorder
2207,"maternally inherited leigh syndrome is a rare subtype of leigh syndrome (see this term) characterized clinically by encephalopathy, lactic acidosis, seizures, cardiomyopathy, respiratory disorders and developmental delay, with onset in infancy or early childhood, and resulting from maternally-inherited mutations in mitochondrial dna.",Disorder
2208,"maternally inherited leigh syndrome is a rare subtype of leigh syndrome (see this term) characterized clinically by encephalopathy, lactic acidosis, seizures, cardiomyopathy, respiratory disorders and developmental delay, with onset in infancy or early childhood, and resulting from maternally-inherited mutations in mitochondrial dna.",Disorder
2209,"maternally inherited leigh syndrome is a rare subtype of leigh syndrome (see this term) characterized clinically by encephalopathy, lactic acidosis, seizures, cardiomyopathy, respiratory disorders and developmental delay, with onset in infancy or early childhood, and resulting from maternally-inherited mutations in mitochondrial dna.",Disorder
2210,"maternally inherited leigh syndrome is a rare subtype of leigh syndrome (see this term) characterized clinically by encephalopathy, lactic acidosis, seizures, cardiomyopathy, respiratory disorders and developmental delay, with onset in infancy or early childhood, and resulting from maternally-inherited mutations in mitochondrial dna.",Disorder
2237,"malignant peripheral nerve sheath tumor with perineurial differentiation is a rare soft tissue sarcoma composed predominantly of spindle-shaped neoplastic cells showing perineurial differentiation and displaying abundant cellular pleomorphism or anaplasia, frequent mitoses, tumor necrosis and high metastatic potential. it often presents as a soft, painless, solid mass in subcutaneous tissues of the trunk or limbs, but tumors have also been described in the facial area, mediastinum, retroperitoneum, pancreas, paravertebral column and the pelvic soft tissues. frequent local recurrence and distant metastatic spread has been reported.",Subtype of disorder
2239,"primary melanoma of the central nervous system is a rare tumor of meninges arising from leptomeningeal melanocytes, typically in the perimedullary or high cervical region, in the absence of melanoma outside the cns. the tumor is typically a darkly pigmented, solid mass, often containing hemorrhagic or necrotic areas, composed of sheets of pleomorphic cells with prominent nucleoli, with frequent mitotic figures and parenchymal invasion. intracranial tumor may present with signs of raised intracranial pressure, focal neurological symptoms related to tumor location, seizures or subarachnoid hemorrhage, spinal tumor may present with back pain, muscle weakness, numbness, plegia or urinary incontinence.",Disorder
2242,"hemangioblastoma is a rare, benign, highly vascularized tumor of the central nervous system, most often located in the cerebellum or spinal cord, presenting in adulthood and manifesting with dizziness, nausea, malaise, headache, bladder or bowel dysfunction, numbness, weakness and pain in the upper or lower extremities, and often associated with von hippel-lindau disease (vhl; see this term). exceptional cases of hemangioblastoma arising outside of the central nervous system have been reported.",Disorder
2248,congenital central hypoventilation syndrome (cchs) is a rare disease due to a severely impaired central autonomic control of breathing and dysfunction of the autonomous nervous system.,Disorder
2265,"progressive osseous heteroplasia (poh) is a rare genetic bone disorder characterized clinically by progressive extraskeletal bone formation presenting in early life with cutaneous ossification, that progressively involves subcutaneous and then subsequently deep connective tissues, including muscle and fascia. poh overlaps with a number of related genetic disorders including albright hereditary osteodystrophy, pseudohypoparathyroidism (see these terms), and primary osteoma cutis, that share the common features of superficial heterotopic ossification in association with inactivating mutations of <i>gnas</i> gene (20q13.2-q13.3), coding for guanine nucleotide-binding proteins. poh can, however, be distinguished clinically by the deep and progressive nature of the heterotopic bone formation.",Disorder
2266,malignant triton tumor (mtt) is a rare aggressive subtype of malignant peripheral nerve sheath tumor (mpnst; see this term) characterized histopathologically by focal rhabdomyoblastic differentiation.,Subtype of disorder
2273,"vestibular schwannoma is a rare tumor of the posterior fossa originating in the schwann cells of the vestibular transitional zone of the vestibulocochlear nerve that can be benign, small, slow growing and asymptomatic or large, faster growing and aggressive and potentially fatal, presenting with symptoms of hearing and balance impairment, vertigo, ataxia, headache and fifth, sixth or seventh cranial nerve dysfunction and facial numbness.",Subtype of disorder
2282,lichen planus (lp) pemphigoides is a rare cross-over syndrome between lichen planus and bullous pemphigoid (see these terms).,Disorder
2287,"inhalational botulism is a man-made form of botulism (see this term), a rare acquired neuromuscular junction disease with descending flaccid paralysis caused by botulinum neurotoxins (bonts).",Subtype of disorder
2289,"iatrogenic botulism is the most recent man-made form of botulism (see this term), a rare acquired neuromuscular junction disease with descending flaccid paralysis caused by botulinum neurotoxins (bonts), and it may occur as an adverse event after therapeutic or cosmetic use.",Subtype of disorder
2314,a rare gestational trophoblastic neoplasmcharacterized histologically by invasion of the myometrium and/or cervix uteri by regular epithelioid cells of chorion laeve type intermediate trophoblasts which clusters in a hyaline stroma. the disease generally occurs several years after pregnancy and indicative signs are irregular metrorrhagia and moderate increases in chorionic gonadotropin levels.,Disorder
2316,a distinct form of duodenal atresia in which the head of the pancreas forms a ring around the second portion of the duodenum.,Disorder
2317,"a rare benign type of choroid plexus tumor often occurring in the fourth ventricle (in adults) and the lateral ventricle (in children) but sometimes arising ectopically in the brain parenchyma, and presenting with nausea, vomiting, papilledema, abnormal eye movements, as well as enlarged head circumference, seizures and gait impairment due to an increase in intracranial pressure.",Disorder
2318,"a rare benign type of choroid plexus tumor often occurring in the fourth ventricle (in adults) and the lateral ventricle (in children) but sometimes arising ectopically in the brain parenchyma, and presenting with nausea, vomiting, papilledema, abnormal eye movements, as well as enlarged head circumference, seizures and gait impairment due to an increase in intracranial pressure.",Disorder
2331,"this syndrome is an isolated upper limb mesomelic dysplasia. it has been described in four patients from two unrelated families (a man and his daughter, and a lebanese man and his son). patients present with ulnar hypoplasia with severe radial bowing, but normal stature. the mode of transmission is likely to be autosomal dominant with variable expressivity.",Disorder
2340,"micro syndrome is an autosomal recessive disorder caracterised by ocular and neurodevelopmental defects and by microgenitalia. it presents with severe intellectual disability, microcephaly, congenital cataract, microcornea, microphthalmia, agenesis/hypoplasia of the corpus callosum, and hypogenitalism.",Disorder
2345,"microcephaly - albinism - digital anomalies syndrome is a very rare syndrome associating microcephaly, micrognathia, oculocutaneous albinism, hypoplasia of the distal phalanx of fingers and agenesia of the distal end of the right big toe.",Disorder
2358,microspherophakia - metaphyseal dysplasia is a very rare syndrome associating bone dysplasia with micromelic dwarfism and eye defects.,Disorder
2362,"mietens syndrome is a very rare syndrome consisting of corneal opacity, nystagmus, strabismus, flexion contracture of the elbows with dislocation of the head of the radius and abnormally short ulnae and radii.",Disorder
2371,moyamoya disease (mmd) is a rare intracranial arteriopathy involving progressive stenosis of the cerebral vasculature located at the base of the brain causing transient ischemic attacks or strokes.,Disorder
2372,"a rare and fatal central nervous system malformation occurring during embryogenesis, presenting prenatally with holoprosencephaly and fetal hypokinesia as major features. other manifestations include microcephaly, multiple contractures and intrauterine growth restriction. there have been no further descriptions in the literature since 1988.",Disorder
2375,"15q11.2 microdeletion syndrome is a rare partial autosomal monosomy with a variable phenotypic expression and reduced penetrance associated with an increased susceptibility to neuropsychiatric or neurodevelopmental disorders including delayed psychomotor development, speech delay, autism spectrum disorder, attention deficit-hyperactivity disorder, obsessive-compulsive disorder, epilepsy or seizures. it may also include mild non-specific dysmorphic features (such as dysplastic ears, broad forehead, hypertelorism), cleft palate, neurological and neuroimaging abnormalities (such as ataxia and muscular hypotonia).",Disorder
2386,"16p13.11 microduplication syndrome is a recently described syndrome associated with variable clinical features including behavioral abnormalities, developmental delay, congenital heart defects and skeletal anomalies.",Disorder
2390,"a rare congenital myopathy characterized ultrastructurally by the presence of tubular aggregates in the subsarcolemmal region of the muscle fiber. it most commonly presents with slowly progressive proximal muscle weakness predominantly of the lower limbs, periodic paralysis, post-exertion muscle cramps, and muscular pain. ocular anomalies like ophthalmoplegia or pupillary abnormalities may be associated. the intensity of the symptoms is variable, cases with normal muscle strength but myalgia or fatigue, as well as clinically asymptomatic cases have been described.",Disorder
2406,"17q12 microduplication syndrome is a rare chromosomal anomaly with variable phenotypic expression and reduced penetrance associated with developmental delay, mild to severe intellectual disability, speech delay, seizures, microcephaly, behavioral abnormalities, autism spectrum disorder, eye or vision defects (such as strabismus, astigmatism, amblyopia, cataract, coloboma, and microphthalmia), non-specific dysmorphic features, hypotonia, cardiac and renal anomalies, schizophrenia.",Disorder
2407,"16q24.3 microdeletion syndrome is a recently described syndrome associated with variable developmental delay, facial dysmorphism, seizures and autistic spectrum disorder.",Disorder
2420,a uniparental disomy of paternal origin that does not seem to have an adverse impact on the phenotype of an individual. there is a possibility of homozygosity for a recessive disease mutation for which the father is a carrier and specific phenotype depends on the inherited disorder.,Disorder
2422,a uniparental disomy of maternal origin that does not seem to have an adverse impact on the phenotype of an individual. there is a possibility of homozygosity for a recessive disease mutation for which the mother is a carrier and specific phenotype depends on the inherited disorder.,Disorder
2447,"an extremely rare syndrome associating dwarfism, characteristic facial appearance, cutis laxa and progressive bone sclerosis.",Disorder
2448,"an extremely rare syndrome associating dwarfism, characteristic facial appearance, cutis laxa and progressive bone sclerosis.",Subtype of disorder
2449,"an extremely rare syndrome associating dwarfism, characteristic facial appearance, cutis laxa and progressive bone sclerosis.",Subtype of disorder
2450,"an extremely rare syndrome associating dwarfism, characteristic facial appearance, cutis laxa and progressive bone sclerosis.",Disorder
2451,"an extremely rare syndrome associating dwarfism, characteristic facial appearance, cutis laxa and progressive bone sclerosis.",Subtype of disorder
2452,"an extremely rare syndrome associating dwarfism, characteristic facial appearance, cutis laxa and progressive bone sclerosis.",Disorder
2453,"an extremely rare syndrome associating dwarfism, characteristic facial appearance, cutis laxa and progressive bone sclerosis.",Subtype of disorder
2454,"an extremely rare syndrome associating dwarfism, characteristic facial appearance, cutis laxa and progressive bone sclerosis.",Disorder
2459,"monoamine oxidase-a deficiency is a very rare recessive x-linked biogenic amine metabolism disorder characterized clinically by mild intellectual deficit, impulsive aggressiveness, and sometimes violent behavior and presenting from childhood.",Disorder
2460,"monoamine oxidase-a deficiency is a very rare recessive x-linked biogenic amine metabolism disorder characterized clinically by mild intellectual deficit, impulsive aggressiveness, and sometimes violent behavior and presenting from childhood.",Disorder
2485,"cog4-cdg is an extremely rare form of cdg syndrome (see this term) characterized clinically in the single reported case to date by seizures, some dysmorphic features, axial hyponia, slight peripheral hypertonia and hyperreflexia.",Disorder
2487,"cog1-cdg is an extremely rare form of cdg syndrome (see this term) characterized clinically in the few cases reported to date by variable signs including microcephaly, growth retardation, psychomotor retardation and facial dysmorphism.",Disorder
2488,"spondyloepiphyseal dysplasia, maroteaux type is a very rare type of spondyloepiphyseal dysplasia (see this term) described in fewer than 10 patients to date and characterized clinically by dysplastic epiphyses, short stature appearing in infancy, short neck, short and stubby hands and feet, scoliosis, genu valgum, abnormal pelvis, osteoporosis and osteoarthritis.",Disorder
2489,"a rare syndrome for which the acronym indicates the principal signs: ra for radial ray defect, pa for both patellae hypoplasia or aplasia and cleft or highly arched palate, di for diarrhea and dislocated joints, li for little size and limb malformations, no for long, slender nose and normal intelligence.",Disorder
2490,"a rare syndrome for which the acronym indicates the principal signs: ra for radial ray defect, pa for both patellae hypoplasia or aplasia and cleft or highly arched palate, di for diarrhea and dislocated joints, li for little size and limb malformations, no for long, slender nose and normal intelligence.",Disorder
2492,"dpm3-cdg is an extremely rare form of cdg syndrome (see this term) characterized clinically in the single reported case by muscle weakness, waddling gait and dilated cardiomyopathy (see this term).",Disorder
2494,"cog5-cdg is an extremely rare form of cdg syndrome (see this term) characterized clinically in the single reported case to date by moderate mental retardation with slow and inarticulate speech, truncal ataxia, and mild hypotonia.",Disorder
2495,"hyperinsulinemic hypoglycemia due to insr deficiency is a very rare autosomal dominant form of familial hyperinsulinism characterized clinically in the single reported family by postprandial hypoglycemia, fasting hyperinsulinemia, and an elevated serum insulin-to-c peptide ratio, and a variable age of onset.",Disorder
2497,"a rare disorder defined by generalized osteosclerosis with periosteal bone formation, characteristic facial dysmorphism, brain abnormalities including intracerebral calcifications, and neonatal lethal course.",Disorder
2500,"chst3-related skeletal dysplasia is a very rare bone disorder characterized clinically by short stature of prenatal onset; dislocation of the knees, hips or elbows; club feet; limitation of range of motion of large joints; progressive kyphosis; and occasional scoliosis. in a few patients, minor heart valve dysplasia has also been described. intellect, vision and hearing are normal.",Disorder
2511,"a rare syndrome that belongs to the group of extreme insulin-resistance syndromes (which also includes leprechaunism, the lipodystrophies, and the type a and b insulin resistance syndromes).",Disorder
2527,"glycogen storage disease type 15 is an extremely rare genetic glycogen storage disease reported in one patient to date. clinical signs included muscle weakness, cardiac arrhythmia associated with accumulation of abnormal storage material in the heart and glycogen depletion in skeletal muscle.",Disorder
2535,schneckenbecken dysplasia (or chondrodysplasia with snail-like pelvis) is a prenatally lethal spondylodysplastic dysplasia.,Disorder
2547,"rothmund-thomson syndrome (rts) is a genodermatosis presenting with a characteristic facial rash (poikiloderma) associated with short stature due to pre- and postnatal growth delay, sparse scalp hair, sparse or absent eyelashes and/or eyebrows, juvenile cataracts, skeletal abnormalities, radial ray defects, premature aging and a predisposition to certain cancers.",Disorder
2561,"a rare developmental defect during embryogenesis where some or all of the pulmonary veins drain into the right atrium or the systemic veins, with or without the presence of pulmonary venous obstruction, leading to various manifestations such as fatigue, exertional dyspnea, pulmonary arterial hypertension, cyanosis and progressive congestive heart failure. the two main subtypes are congenital partial pulmonary venous return anomaly (papvc; see this term), where one or a few of the pulmonary veins are anomalous, and congenital total pulmonary venous return anomaly (tapvc, see this term), where all of the pulmonary veins are anomalous.",Group of disorders
2624,"a rare congenital genital anomaly in which the scrotum is positioned superior and anterior to the penis. pst may present with a broad spectrum of anomalies ranging from simple shawl scrotum (doughnut scrotum) to very complex extreme transposition with craniofacial, central nervous system, cardiac, gastrointestinal, urological, and other genital (undescended testicles, hypospadias, chordee) malformations. growth deficiency and intellectual disability may also be noticed (60% of cases).",Disorder
2626,pericardial and diaphragmatic defect is a rare combination of absent pericardium with congenital diaphragmatic defect.,Disorder
2658,"peho (progressive encephalopathy with edema, hypsarrhythmia and optic atrophy) syndrome is a rare neurodegenerative disorder belonging to the group of infantile progressive encephalopathies.",Disorder
2659,"mycophenolate mofetil (mmf) embryopathy is a malformative syndrome due to the teratogenic effect of mmf, an effective immunosuppressive agent widely used for the prevention of organ rejection after organ transplantation.",Disorder
2663,thiamine-responsive maple syrup urine disease (thiamine-responsive msud) is a less severe variant of msud (see this term) that manifests with a phenotype similar to intermediate msud (see this term) but that responds positively to treatment with thiamine.,Subtype of disorder
2666,"intermittent maple syrup urine disease (intermittent msud) is a mild form of msud (see this term) where patients (when well) are asymptomatic with normal levels of branched-chain amino acids (bcaas) but with catabolic stress are at risk of acute decompensation with ketoacidosis, which can lead to cerebral edema and coma if untreated.",Subtype of disorder
2667,proteus-like syndrome describes patients who do not meet the diagnostic criteria for proteus syndrome (see this term) but who share a multitude of characteristic clinical features of the disease.,Disorder
2675,"a very rare disorder associating pseudopapilledema (optic disc swelling not secondary to increased intracranial pressure), mixed hearing loss, facial dysmorphism and limb extremity anomalies.",Disorder
2701,"trisomy 8p is a rare chromosomal anomaly syndrome, resulting from the partial duplication of the short arm of chromosome 8, with highly variable phenotype ranging from no dysmorphic features and only mild intellectual disability to patients with severe developmental delay, neonatal hypotonia, short stature, profound intellectual disability, mild dysmorphic features (e.g. mild ptosis, hypertelorism, down-slanting palpebral fissures, broad nasal bridge, short, prominent philtrum, abnormal dentition) and structural brain abnormalities. autism, epilepsy, and spastic paraplegia have also been reported.",Disorder
2706,polydactyly-myopia syndrome is an exceedingly rare autosomal dominant developmental anomaly reported in 1986 in nine individuals among four generations of the same family. the syndrome is characterized clinically by four-limb postaxial polydactyly and progressive myopia. there have been no further descriptions in the literature since 1986.,Disorder
2710,"isolated pauciimmune pulmonary capillaritis is a small vessel vasculitis restricted to the lungs that may induce diffuse alveolar hemorrhage with dyspnea, anemia, chest pain, hemoptysis, bilateral and diffuse alveolar infiltrates at chest x-rays, without any underlying systemic disease. anca are frequently positive but could be negative.",Disorder
2738,"vacterl is an acronym for vertebral anomalies, anal atresia, congenital cardiac disease, tracheoesophageal fistula, renal anomalies, and limb defects. vacterl associated with hydrocephalus has rarely been reported and is thought to be an autosomal recessive anomaly. the condition is described as a uniformly lethal or developmentally devastating disorder distinct from the vater association.",Disorder
2745,"an extremely rare familial bone deformity described only in japanese patients to date. the deformity is bilateral in nearly half of patients (with bilateral involvement, the condition is symmetrical) and sometimes causes ulnar nerve palsy or cubitus varus.",Disorder
2759,"tibia absent - polydactyly - arachnoid cyst syndrome is a very rare constellation of multiple anomalies, including absence or hypoplasia of the tibia.",Disorder
2766,"a very rare genetic necrotic bone disorder characterized clinically by painless swelling of the proximal interphalangeal joints associated with osteonecrosis of epiphyses followed by osteoarthritic changes, with onset before 25 years of age and often a benign course.",Disorder
2767,"a very rare genetic necrotic bone disorder characterized clinically by painless swelling of the proximal interphalangeal joints associated with osteonecrosis of epiphyses followed by osteoarthritic changes, with onset before 25 years of age and often a benign course.",Disorder
