,Definition,ClassificationLevel
1,"a rare neurodegenerative disorder of the astrocytes comprised of two clinical forms: alexander disease (axd) type i and type ii manifesting with various degrees of macrocephaly, spasticity, ataxia and seizures and leading to psychomotor regression and death.",Disorder
6,an autosomal recessive lysosomal storage disease belonging to the oligosaccharidosis group (also called glycoproteinosis).,Disorder
28,"glycogen branching enzyme (gbe) deficiency (andersen's disease or amylopectinosis), or glycogen storage disease type 4 (gsd4), is a rare and severe form of glycogen storage disease which accounts for approximately 3% of all the glycogen storage diseases (see these terms).",Disorder
32,"liver phosphorylase deficiency, or glycogen storage disease type 6b (hers' disease, gsd 6b) is a benign and rare form of glycogen storage disease.",Disorder
36,rare cutaneous lupus erythematosus (cle) is an autoimmune disease that denotes a heterogeneous spectrum of clinical manifestations affecting the skin and can be divided into 4 categories: acute cle (acle); subacute cle (scle); chronic cle (ccle; the most diverse form); and intermittent cle (icle). cle can either occur alone or associated with systemic lupus erythematosus (sle).,Group of disorders
41,"mucopolysaccharidosis type 6 (mps 6) is a lysosomal storage disease with progressive multisystem involvement, associated with a deficiency of arylsulfatase b (asb) leading to the accumulation of dermatan sulfate.",Disorder
44,"a rare skeletal disorder characterized clinically by multiple fractures, wormian bones of the skull, dentinogenesis imperfecta and facial dysmorphism (hypertelorism, periorbital fullness). although the signs are very similar to osteogenesis imperfecta, characteristic cortical defects in the absence of osteopenia and collagen abnormalities are considered to be distinctive. there have been no further descriptions in the literature since 1999.",Disorder
47,"a rare lysosomal storage disease characterized clinically by severe global development delay due to neuronal dysmyelination, hypotonia which gradually progresses to spasticity during childhood, speech deficits, progressive visual impairment (due to corneal clouding, retinal degeneration and optic atrophy), achlorhydria, with increased gastrin secretion and iron deficiency anemia, and kidney disease and failure, all in the absence of dysmorphic features.",Disorder
48,"a rare lysosomal storage disease characterized clinically by severe global development delay due to neuronal dysmyelination, hypotonia which gradually progresses to spasticity during childhood, speech deficits, progressive visual impairment (due to corneal clouding, retinal degeneration and optic atrophy), achlorhydria, with increased gastrin secretion and iron deficiency anemia, and kidney disease and failure, all in the absence of dysmorphic features.",Disorder
55,"poliomyelitis is a viral infection caused by any of three serotypes of human poliovirus, which is part of the family of enteroviruses.",Disorder
79,"a group of rare, genetic, progressive muscular dystrophies, including duchenne muscular dystrophy (dmd), becker muscular dystrophy (bmd) and a symptomatic form in female carriers. the diseases represent a spectrum of severity ranging from progressive skeletal and cardiac muscle wasting and weakness (dmd, bmd) to less severe muscle weakness or isolated cardiomyopathy affecting carrier females.",Group of disorders
108,"a subgroup of therapy-related myeloid neoplasms (t-mn), associated with treatment of an unrelated neoplastic disease with radiation. the neoplastic cells typically harbor unbalanced aberrations of chromosomes 5 and 7 (monosomy 5/del(5q) and monosomy 7/del(7q)) or a complex karyotype. patients frequently present with multilineage dysplasia and cytopenias 5-10 years after exposure.",Disorder
117,"von hippel-lindau disease (vhl) is a familial cancer predisposition syndrome associated with a variety of malignant and benign neoplasms, most frequently retinal, cerebellar, and spinal hemangioblastoma, renal cell carcinoma (rcc), and pheochromocytoma.",Disorder
142,"a rare eye tumor disease representing the most common intraocular malignancy in children. it is a life threatening neoplasia but is potentially curable and it can be hereditary or non hereditary, unilateral or bilateral.",Disorder
146,"a rare genetic disease associated with mild to severe intellectual deficit that may be associated with behavioral disorders and characteristic physical features including a high forehead, prominent and large ears, hyperextensible finger joints, flat feet with pronation and, in adolescent and adult males, macroorchidism.",Disorder
147,"rheumatic fever (rf) is a multisystem inflammatory disease occurring as a post-infectious, nonsuppurative sequela of untreated streptococcus pyogenes (group a streptococcus [gas]) pharyngitis, and mainly occurs in individuals aged 5 to 15 years. the most common presenting signs are fever, migratory polyarthritis and carditis.",Disorder
149,"a clinically variable form of isolated agammaglobulinemia, an inherited immunodeficiency disorder, characterized in affected males by recurrent bacterial infections during infancy.",Subtype of disorder
150,"a lysosomal storage disease with multisystemic involvement leading to a massive accumulation of glycosaminoglycans and a wide variety of symptoms including distinctive coarse facial features, short stature, cardio-respiratory involvement and skeletal abnormalities. it manifests as a continuum varying from a severe form with neurodegeneration to an attenuated form without neuronal involvement.",Disorder
151,"mucopolysaccharidosis type 1 (mps 1) is a rare lysosomal storage disease belonging to the group of mucopolysaccharidoses. there are three variants, differing widely in their severity, with hurler syndrome being the most severe, scheie syndrome the mildest and hurler-scheie syndrome giving an intermediate phenotype.",Disorder
152,"a rare genetic disorder of copper metabolism presenting with non-specific hepatic, neurologic, psychiatric or ophthalmologic manifestations due to impaired biliary copper excretion and consecutive excessive copper deposition in the body.",Disorder
155,"a form of cutaneous lupus erythematosus (cle) that can present either as a non-scarring, annular photo-distributed dermatosis or psoriasiform plaques. this disorder is associated with anti-ro/ssa antibodies and can be drug-induced.",Disorder
157,"a form of cutaneous lupus erythematosus (cle) that includes five different forms: discoid lupus erythematosus (dle), chilblain lupus, hypertrophic or verrucous lupus erythematosus, lupus erythematosus tumidus, and lupus erythematosus panniculitis.",Group of disorders
204,"the 2p21 microdeletion syndrome consists of cystinuria, neonatal seizures, hypotonia, severe growthand developmental delay, facial dysmorphism, and lactic acidemia.",Disorder
213,"lesch-nyhan syndrome (lns) is the most severe form of hypoxanthine-guanine phosphoribosyltransferase (hprt) deficiency (see this term), a hereditary disorder of purine metabolism, and is associated with uric acid overproduction (uao), neurological troubles, and behavioral problems.",Disorder
226,"a rare disorder marked by short stature with short extremities (final adult height is 120cm +/- 10cm), and joint malformations leading to multiple joint contractures (principally involving the shoulders, elbows, interphalangeal joints and hips).",Disorder
233,"an acrocephalosyndactyly associated with craniosynostosis, midfacial hypoplasia, hand and foot malformation with a wide range of clinical expression and severity. most of the affected patients show various other associated manifestations.",Disorder
243,"cat eye syndrome (ces) is a rare chromosomal disorder with a highly variable clinical presentation. most patients have multiple malformations affecting the eyes (iris coloboma), ears (preauricular pits and/or tags), anal region (anal atresia), heart and kidneys. intellectual disability is usually mild or borderline normal.",Disorder
253,"mccune-albright syndrome (mas) is classically defined by the clinical triad of fibrous dysplasia of bone (fd), café-au-lait skin spots, and precocious puberty (pp).",Disorder
255,"a group of clinically heterogeneous diseases, commonly defined by lack of cellular energy due to defects of oxidative phosphorylation (oxphos), resulting from pathogenic mutations in the nuclear dna. mitochondrial oxidative phosphorylation disorder due to nuclear dna anomalies includes diseases classified according to defects in: genes encoding structural components of oxphos complexes (such as leigh syndrome, coenzyme q10 deficiency); genes encoding assembly factors of oxphos complexes (such as gracile syndrome); genes altering the stability of mitochondrial dna (such as autosomal dominant progressive external ophthalmoplegia, mitochondrial dna depletion syndrome); mitochondrial protein synthesis.",Disorder
262,"schistosomiasis is an infectious disease caused by parasitic trematodes of the genus <i>schistosoma</i> that colonize human blood vessels and release eggs that can cause granulomatous reactions leading to acute (swimmer's itch or acute schistosomiasis syndrome) or chronic disease. depending on where the eggs lodge, manifestations of chronic schistosomiasis can include diarrhea, abdominal pain, loss of appetite, anemia (intestines), hepatosplenism, periportal fibrosis with portal hypertension (liver), urogenital inflammation and scarring, hematuria and dysuria (genitourinary system). other patients may be asymptomatic.",Disorder
281,intermediate nemaline myopathy is a type of nemaline myopathy (nm; see this term) that shows features of typical nm (see this term) in neonates with a more severe progression.,Disorder
309,"a rare partial trisomy of the short arm of chromosome 18 manifesting with a highly variable clinical phenotype which may include variable developmental delay and intellectual disability, epilepsy, and non-specific dysmorphic features, among others.",Disorder
324,"primary peritoneal carcinoma (ppc) is a rare malignant tumor of the peritoneal cavity of extra-ovarian origin, clinically and histologically similar to advanced-stage serous ovarian carcinoma (see this term).",Disorder
328,malignant peritoneal mesothelioma is a primary peritoneal malignancy occurring in the lining cells (mesothelium) of the peritoneal cavity.,Disorder
336,"a rare sex chromosome aneuploidy where males receive an additional y chromosome, that is characterized clinically by tall stature evident from childhood, macrocephaly, facial features (mild hypertelorism, low set ears, a mildly flat malar region), speech delay and an increased risk for social and emotional difficulties, attention deficit hyperactive disorder and autistic spectrum disorder.",Disorder
338,"hypereosinophilic syndrome (hes) constitutes a rare and heterogeneous group of disorders, defined as persistent and marked blood eosinophilia and/or tissue eosinophilia associated with a wide range of clinical manifestations reflecting eosinophil-induced tissue/organ damage.",Group of disorders
343,monosomy 18p refers to a chromosomal disorder resulting from the deletion of all or part of the short arm of chromosome 18.,Disorder
348,"a large, or giant, congenital melanocytic nevus (lcmn or gcmn) is a pigmented skin lesion of more than 20 cm - or 40 cm- respectively, projected adult diameter, composed of melanocytes, and presenting with an elevated risk of malignant transformation.",Disorder
350,"pentasomy x is a sex chromosome anomaly caused by the presence of three extra x chromosomes in females (49,xxxxx instead of 46,xx).",Disorder
352,"glycogen storage disease (gsd) due to phosphorylase kinase deficiency is a group of inborn errors of glycogen metabolism that is clinically and genetically heterogeneous. this group comprises gsd due to liver phosphorylase kinase (phk) deficiency, gsd due to muscle phk deficiency and gsd due to liver and muscle phk deficiency (see these terms).",Group of disorders
363,bethlem myopathy is a benign autosomal dominant form of slowly progressive muscular dystrophy.,Disorder
366,"tetrasomy 18p is a very rare structural chromosomal anomaly affecting multiple body systems and characterized clinically by craniofacial abnormalities, delayed development, cognitive impairment, changes in muscle tone, distinctive facial features, and rarely renal malformations.",Disorder
367,"tetrasomy 18p is a very rare structural chromosomal anomaly affecting multiple body systems and characterized clinically by craniofacial abnormalities, delayed development, cognitive impairment, changes in muscle tone, distinctive facial features, and rarely renal malformations.",Disorder
370,"a variant of intermediate severity of the pbd-zellweger syndrome spectrum (pbd-zss) charcterized by hypotonia, leukodystrophy, and vision and sensorineural hearing deficiencies. phenotypic overlap is seen between nald and infantile refsum disease (ird).",Disorder
373,"a rare vascular malformation disorder with cutaneous and visceral lesions frequently associated with serious, potentially fatal bleeding and anemia.",Disorder
376,"a rare neurometabolic disorder of gamma-aminobutyric acid (gaba) metabolism with a nonspecific clinical presentation (ranging from mild to severe) with the most frequent symptoms being cognitive impairment with prominent deficit in expressive language, hypotonia, ataxia, epilepsy, and behavioral dysregulation.",Disorder
387,"tetrasomy x is a sex chromosome anomaly caused by the presence of two extra x chromosomes in females (48,xxxx instead of 46,xx).",Disorder
391,"a number of families have been described, where several members were affected with coarctation of aorta. in a systematic study of coarctation, familial aggregation was considered as result of multifactorial inheritance and recurrence risks in sibs was evaluated at about 0.5% for coarctation and 1.0% for any form of congenital heart defect. nevertheless, in some of the described families, aortic coarctations seems to be inherited as an autosomal dominant mutation.",Subtype of disorder
392,"a number of families have been described, where several members were affected with coarctation of aorta. in a systematic study of coarctation, familial aggregation was considered as result of multifactorial inheritance and recurrence risks in sibs was evaluated at about 0.5% for coarctation and 1.0% for any form of congenital heart defect. nevertheless, in some of the described families, aortic coarctations seems to be inherited as an autosomal dominant mutation.",Subtype of disorder
399,"hereditary north american indian childhood cirrhosis is a severe autosomal recessive intrahepatic cholestasis that has only been described in aboriginal children from northwestern quebec. manifesting first as transient neonatal jaundice, the disease evolves into periportal fibrosis and cirrhosis during a period ranging from childhood to adolescence.",Subtype of disorder
402,sudden infant death with dysgenesis of the testes (siddt) syndrome is a lethal condition in infants with dysgenesis of testes.,Disorder
403,"charlie m syndrome is a rare bone developmental disorder which belongs to a group of oromandibular limb hypogenesis syndromes that includes hypoglossia-hypodactyly and glossopalatine ankylosis (see these terms). the major anomalies which occur commonly in this group are hypoplasia of the mandible, syndactyly and ectrodactyly, small mouth, cleft palate, hypodontia, and facial paralysis. patients with charlie m syndrome also present with hypertelorism, absent or conically crowned incisors, and variable degrees of hypodactyly of the hands and feet. there have been no further descriptions in the literature since 1976.",Disorder
407,hypermethioninemia due to methionine adenosyltransferase deficiency is a very rare metabolic disorder resulting in isolated hepatic hypermethioninemia that is usually benign due to partial inactivation of enzyme activity. rarely patients have been found to have an odd odor or neurological disorders such as brain demyelination.,Disorder
408,hypermethioninemia due to methionine adenosyltransferase deficiency is a very rare metabolic disorder resulting in isolated hepatic hypermethioninemia that is usually benign due to partial inactivation of enzyme activity. rarely patients have been found to have an odd odor or neurological disorders such as brain demyelination.,Disorder
409,hypermethioninemia due to methionine adenosyltransferase deficiency is a very rare metabolic disorder resulting in isolated hepatic hypermethioninemia that is usually benign due to partial inactivation of enzyme activity. rarely patients have been found to have an odd odor or neurological disorders such as brain demyelination.,Subtype of disorder
419,blackfan-diamond anemia (dba) is a congenital aregenerative and often macrocytic anemia with erythroblastopenia.,Disorder
420,blackfan-diamond anemia (dba) is a congenital aregenerative and often macrocytic anemia with erythroblastopenia.,Disorder
421,"combined oxidative phosphorylation deficiency type 3 is an extremely rare clinically heterogenous disorder described in about 5 patients to date. clinical signs included hypotonia, lactic acidosis, and hepatic insufficiency, with progressive encephalomyopathy or hypertrophic cardiomyopathy.",Disorder
425,"bloom syndrome is a rare disorder associated with pre- and postnatal growth deficiency, a telangiectatic erythematous rash of the face and other sun-exposed areas, insulin resistance and predisposition to early onset and recurrent cancer of multiple organ systems.",Disorder
426,"a rare autosomal recessive amino acid metabolism disorder characterized clinically by variable degrees of hyperammonemia, developing from about 3 years of age, and leading to progressive loss of developmental milestones and spasticity in the absence of treatment.",Disorder
442,"a rare ectodermal dysplasia syndrome that often presents with the classic triad of nail dysplasia, skin pigmentary changes, and oral leukoplakia associated with a high risk of bone marrow failure (bmf) and cancer.",Disorder
444,"dubowitz syndrome (ds) is a rare multiple congenital syndrome characterized primarly by growth retardation, microcephaly, distinctive facial dysmorphism, cutaneous eczema, a mild to severe intellectual deficit and genital abnormalities.",Disorder
451,"isolated glycerol kinase deficiency (gkd) is a very rare x-linked disorder of glycerol metabolism characterized biochemically by elevated plasma and urine glycerol levels, and clinically by variable neurometabolic manifestations, depending on the age of onset, and varying from a life-threatening childhood metabolic crisis to an asymptomatic adult form (infantile gkd, juvenile gkd, and adult gkd (see these terms)).",Disorder
456,"dihydropteridine reductase (dhpr) deficiency is a severe form of hyperphenylalaninemia (hpa) due to impaired regeneration of tetrahydrobiopterin (bh4) (see this term), leading to decreased levels of neurotransmitters (dopamine, serotonin) and folate in cerebrospinal fluid, and causing neurological symptoms such as psychomotor delay, hypotonia, seizures, abnormal movements, hypersalivation, and swallowing difficulties.",Subtype of disorder
465,neonatal hemochromatosis (nh) is an iron storage disorder present at birth. it is a distinct entity that differs from adult hemochromatosis with respect to its molecular origin.,Disorder
478,"foetal parvovirus syndrome is a foetopathy likely to occur when a pregnant woman is infected by parvovirus b19. in adults, the virus causes a butterfly erythema infectiosum (also called fifth disease; 'slapped cheek disease') and flu-like symptoms with symmetric polyarthralgias, which usually do not warrant prenatal diagnosis.",Disorder
484,"a rare congenital anomaly of the kidney and urinary tract (cakut) in which one or both kidneys (unilateral or bilateral mcdk respectively) are large, distended by multiple cysts, and non-functional. unilateral mcdk is typically asymptomatic if the other kidney is fully functional but may occasionally present with abdominal obstructive signs when the cysts become too large. bilateral mcdk is considered a lethal entity and neonates present with features of the potter sequence, severe pulmonary hypoplasia and severe renal failure, and generally die shortly after birth.",Disorder
486,"neuroblastoma is a malignant tumor of neural crest cells, the cells that give rise to the sympathetic nervous system, which is observed in children.",Disorder
494,pallister-killian syndrome (pks) is a rare multiple congenital anomaly/intellectual deficit syndrome caused by mosaic tissue-limited tetrasomy for chromosome 12p.,Disorder
504,"an infectious embryofetopathy that may present in an infant as a result of maternal infection early in pregnancy and subsequent fetal infection with rubella virus. the disorder can lead to deafness, cataract, and variety of other permanent manifestations including cardiac and neurological defects.",Disorder
509,"congenital short bowel syndrome is a rare intestinal disorder of neonates of unknown etiology. patients are born with a short small bowel (less than 75 cm in length) that compromises proper intestinal absorption and leads chronic diarrhea, vomiting and failure to thrive.",Disorder
510,"hereditary fructose intolerance (hfi) is an autosomal recessive disorder of fructose metabolism (see this term), resulting from a deficiency of hepatic fructose-1-phosphate aldolase activity and leading to gastrointestinal disorders and postprandial hypoglycemia following fructose ingestion. hfi is a benign condition when treated, but it is life-threatening and potentially fatal if left untreated.",Disorder
524,"a group of rare vaginal tumors comprising hpv-associated and hpv-independent squamous cell carcinoma, glandular tumors (including hpv-associated adenocarcinoma, endometrioid carcinoma, clear cell carcinoma, gastric type and intestinal type mucinous carcinoma, and mesonephric adenocarcinoma), adenocarcinoma of skene gland origin, adenosquamous carcinoma, and adenoid basal carcinoma. depending on the type of tumor and disease stage, patients may present with symptoms related to a vaginal mass, vaginal bleeding and/or discharge, postcoital bleeding, urinary symptoms, pelvic pain, and a foreign body sensation within the vagina.",Disorder
525,a progressive neurological disease defined by specific neuropathological features associating brainstem and basal ganglia lesions.,Group of disorders
530,a group of rare uterine adnexal tumors comprising non-metastasizing neoplasms arising from the fallopian tube. this includes epithelial tumors (benign serous tumors such as serous adenofibroma and papilloma) and mature teratomas. patients may be asymptomatic or present with tubal obstruction.,Disorder
532,a rare malformation consisting of a membrane-like structure that extends across the laryngeal lumen close to the level of the vocal cords.,Disorder
533,a rare malformation consisting of a membrane-like structure that extends across the laryngeal lumen close to the level of the vocal cords.,Disorder
535,"paget disease of the nipple describes a rare presentation of breast cancer, seen most frequently in women aged 50-60, manifesting with nipple drainage and itching, erythema, crusty and excoriated nipple, thickened plaques, and hyperpigmentation (less frequently). it is due to tumor cells invading the nipple-areola complex and represents 1-3% of all new breast cancer diagnoses.",Disorder
541,"a rare fibroepithelial neoplasm usually presenting in adult females with a well circumscribed mobile masses that grow rapidly and sometimes with additional non-specific symptoms such as dilated skin veins, nipple retraction, skin ulcers, palpable axillary lymphadenopathy or blue discoloration of the skin. the neoplasm can be benign or malignant.",Disorder
542,"a rare fibroepithelial neoplasm usually presenting in adult females with a well circumscribed mobile masses that grow rapidly and sometimes with additional non-specific symptoms such as dilated skin veins, nipple retraction, skin ulcers, palpable axillary lymphadenopathy or blue discoloration of the skin. the neoplasm can be benign or malignant.",Disorder
543,"giant adenofibroma of the breast is a rare, benign, fibroepithelial tumor which usually manifests as a unilateral, painless, firm, mobile, slow-growing mass in the breast that measures more than 5 cm. it can be associated with significant asymmetry and/or deformity of the breast and hormonal changes (e.g. puberty, pregnancy, oral contraceptives) can lead to its marked enlargement.",Disorder
545,"a muscular channelopathy presenting with a pure myotonia dramatically aggravated by potassium ingestion, with variable cold sensitivity and no episodic weakness. this group includes three forms: myotonia fluctuans, myotonia permanens, and acetazolamide-responsive myotonia.",Group of disorders
564,"early-onset autosomal dominant alzheimer disease (eoad) is a progressive dementia with reduction of cognitive functions. eoad presents the same phenotype as sporadic alzheimer disease (ad) but has an early age of onset, usually before 60 years old.",Disorder
593,a rare congenital neurocutaneous syndrome defined by a facial capillary malformation or port-wine birthmark (pwb) associated with cerebral and ocular ipsilateral vascular malformations in most of the cases resulting in variable ocular and neurological complications.,Disorder
595,"tracheal agenesis (ta) is a rare congenital malformation in which the trachea may be completely absent (agenesis), or partially in place but underdeveloped (atresia). in both cases, proximal-distal communication between the larynx and the alveoli of the lungs is lacking.",Disorder
